volume,one_week_perf,one_month_perf,three_month_perf,six_month_perf,one_year_perf,bull_bear_signal,technical_rating,ad_trend,avg_volume_6_days,avg_volume_9_days,avg_volume_12_days,avg_volume_15_days,avg_volume_30_days,q1,q2,q3,q4,capital_fund_to_rwa,npl_to_total_loan,return_on_equity,total_loan_loss_provision_to_npl,symbol,market_cap,eps_ttm,roa_ttm,roe_ttm,pr_ratio
204068,-2.6,-6.96,13.99,10.61,63.85,-,-,Distribution,195049.0,221225.0,239778.0,254716.0,342924.0,71.24%,-6.17%,71.24%,71.24%,,,,,HRL (Himalayan Reinsurance Limited),101649600000,11.86,,,82.38
12477,-6.29,-5.55,-0.44,-0.89,75.26,-,SL,Distribution,7163.0,6702.0,7544.0,7069.0,7205.0,,,,,,,,,MKCL (Muktinath Krishi Company Limited),10409000000,4.19,,,354.99
59694,-1.4,-8.12,30.08,54.1,74.35,-,-,Distribution,120611.0,138007.0,135093.0,135661.0,176775.0,,,,,,,,,NRIC (Nepal Reinsurance Company Limited),164421794425,,,,
22149,-2.39,-8.65,-15.65,4.1,24.92,-,SL,Distribution,35022.0,35380.0,37784.0,37991.0,41351.0,-16.87%,-8.60%,23.46%,40.90%,,,,,NRM (Nepal Republic Media Limited),4489200000,-1.2,,,-386.63
21823,-2.33,-3.3,-3.4,-10.61,5.58,-,-,Distribution,26463.0,23601.0,25968.0,23457.0,19963.0,-14.33%,-3.81%,-9.22%,-5.28%,,,,,NTC (Nepal Doorsanchar Company),157590000000,29.28,,,29.9
5018,-3.03,-4.02,-5.85,-6.98,27.95,-,-,Accumulation,5472.0,5315.0,6068.0,5893.0,5949.0,115.54%,-1.50%,215.33%,215.33%,,,,,NWCL (Nepal Warehousing Company Limited),6393750000,,,,
